{
  "schema_version": "0.5.0",
  "case_ref": "CASE-0001",
  "relationship_id": "REL-0003",
  "origin_ref": "MODEL:origin-alpha:v1",
  "derivative_ref": "MODEL:student-beta:v1",
  "evidence_refs": [
    "EVIDENCE-0001",
    "EVIDENCE-0005"
  ],
  "dependency_type": "independent",
  "evidentiary_effect": "conflicting",
  "dependency_source_ref": null,
  "basis": [
    "EVIDENCE-0001 detected the watermark signal above threshold",
    "EVIDENCE-0005 did not reproduce the signal above threshold"
  ],
  "confidence": 0.95,
  "assumptions": [
    "the reproduction procedure was sufficiently comparable"
  ],
  "limitations": [
    "failure to reproduce does not by itself invalidate the original measurement"
  ],
  "created_at": "2026-09-07T01:15:00Z"
}
